{
  "objet_id": "1NSI-TC-CO-033",
  "gate": "sympy",
  "verdict": "pass",
  "details": {
    "checks": [
      {
        "type": "verify",
        "index": 0,
        "pass": true,
        "detail": ""
      },
      {
        "type": "ruff",
        "index": 0,
        "pass": true,
        "detail": ""
      },
      {
        "type": "ruff",
        "index": 1,
        "pass": true,
        "detail": ""
      }
    ]
  },
  "reviewer": "verify_python.py",
  "created_at": "2026-07-15T22:01:04.724542+00:00"
}