{
  "objet_id": "1NSI-TC-EX-014",
  "gate": "sympy",
  "verdict": "pass",
  "details": {
    "checks": [
      {
        "type": "trace",
        "index": 0,
        "pass": true,
        "detail": ""
      },
      {
        "type": "ruff",
        "index": 0,
        "pass": true,
        "detail": ""
      }
    ]
  },
  "reviewer": "verify_python.py",
  "created_at": "2026-07-15T23:01:24.143314+00:00"
}